internalTaxonId,scientificName,kingdomName,phylumName,className,orderName,familyName,genusName,speciesName,infraType,infraName,infraAuthority,subpopulationName,authority,taxonomicNotes
13928,Muntiacus rooseveltorum,ANIMALIA,CHORDATA,MAMMALIA,CETARTIODACTYLA,CERVIDAE,Muntiacus,rooseveltorum,,,,,"Osgood, 1932","The taxonomic status of <em>M. rooseveltorum</em> has been controversial for over 60 years, and the species was even relegated by Groves and Grubb (1990) to the synonymy of <em>M. feae</em>. However, genetic analysis of the holotype (Amato <em>et al.</em> 1999a,b, 2000; Le <em>et al.</em> 2014a) and morphological investigations (R.J. Timmins pers. comm. 2015) confirm the species' validity with respect to all previously-named taxa. More complex is its relationship with several subsequently proposed names, <em>M. truongsonensis</em>, <em>M. putaoensis</em>, and <em>M. puhoatensis</em>. <br/><br/><em>M. rooseveltorum</em> forms a clade with <em>M. truongsonensis</em> and <em>M. putaoensis</em> supported genetically (Amato <em>et al.</em> 1999b, 2000; James <em>et al.</em> 2008; Le <em>et al.</em> 2014 a, b) and morphologically, by the presence of the combination of well developed canines in females and small, generally unbranched, but regularly shed, antlers in males (R.J. Timmins pers. comm. 2008). The nominal taxon <em>M. puhoatensis</em> is also very likely to belong to this clade (R.J. Timmins pers. comm. 2008). It is still unclear how many species-level taxa there are in this clade, here referred to as the <em>M. r</em>ooseveltorum species-complex (because <em>rooseveltorum </em>is the earliest available name within the complex). At present, diagnostic characters for individual taxa are limited to base sequences of four genes, although for <em>M. puhoatensis</em> even this is not available (Amato <em>et al.</em> 1999b, 2000); the dangers inherent in using mtDNA data to determine taxonomic and phylogenetic relationships among closely related populations urge caution in drawing firm conclusions without establishing congruence with variation of nuclear DNA (both autosomal and Y-chromosome) and morphological characters (Ballard and Whitlock 2004). No such analysis has been performed within this species-complex. Neither the congruence of various morphological features speculated to be important in identifying species within this complex, nor the variation in each character within each apparent species, have been analysed: too few specimens exist for such an analysis. Specimens are particularly few, which allow the full set of skull and pelage characters to be assessed, and where skull and skin are known to be from the same original animal. The accounts for <em>M. truongsonensis</em> and <em>M. puhoatensis</em> (described from one frontlet [antlers and a bit of the skull] lacking any morphological characteristics likely to be necessary for species diagnosis within this species-complex) consider some linked taxonomic and nomenclatorial ambiguities specific to the application of those two names which in turn affect application of the name <em>M. rooseveltorum</em>. Synonymy of either or both <em>M. truongsonensis</em> and <em>M. puhoatensis</em> with <em>M. rooseveltorum</em> cannot be ruled out, although one or both could be valid species. <br/><br/>Le <em>et al.</em> (2014a) reported <em>M. rooseveltorum</em> from the Pu Hoat and Xuan Lien Nature Reserves of Vietnam on the basis of the 16s mitochondrial gene, analysed from four specimens; the paper also claimed to have confirmed the identification on the basis of other mitochondrial genes and nuclear genes, but these apparently have never been determined for the <em>M. rooseveltorum</em> holotype, and furthermore the paper presents no data to support the claim that nuclear genes provide taxonomic resolution of the sampled specimens’ identities. Le <em>et al.</em> (2014 b) report nine cytochrome b sequences from samples collected in Xuan Lien NR as analogous to <em>M. rooseveltorum. </em>Neither paper lists actual details of the sources of their sequences, and the sample numbers given in each paper follow different formats, leaving it uncertain as to whether some of the samples are common to both studies. The reported locality of the Pu Hoat samples however is close to if not the same as the type locality of <em>M. puhoatensis</em>, a species undiagnosable at present because the type material is fragmentary, lacking any known diagnostic features, and has also never been genetically analysed with certainty (Minh Le Duc pers. comm. 2015, R.J. Timmins pers. comm. 2015). Two relatively complete muntjac specimens from the <em>M. rooseveltorum</em> species-complex from the Pu Hoat region seen by R.J. Timmins (pers. comm. 2015) had several morphological characteristics at variance with the holotype of <em>M. rooseveltorum</em> suggesting that the identification of muntjac specimens from the Pu Hoat region should be taken with care, until identification can be corroborated by additional evidence including morphology and nuclear DNA (R.J. Timmins pers. comm. 2015). Several popular media articles that reported the findings of Le <em>et al.</em> (2014) also included camera-trap photographs from Xuan Lien Nature Reserve purported to show <em>M. rooseveltorum</em>; however the muntjacs visible in these photographs were either certainly identifiable as <em>M. vaginalis</em> or unidentifiable to species as they lacked visible diagnostic characteristics.<br/><br/>The animals of northern Myanmar taken to be <em>M. putaoensis</em> shows pelage similarities to <em>M. rooseveltorum</em> sensu stricto, specifically reduced dark frontal stripes, short rather than long crown hair tuft and generally rather uniform, and pale, body and tail pelage. There are several camera-trap photographs of animals from Lao PDR and Viet Nam (outside the presumed range of <em>M. putaoensis</em>) of <em>M. rooseveltorum</em>-type animals which show pelage of pale sandy brown to darker orange similar to that shown by animals of northern Myanmar believed to be <em>M. putaoensis </em>(R.J. Timmins pers. comm. 2008). <em>M. putaoensis</em> is generally assumed to be geographically isolated from<em> M. rooseveltorum</em>, and current known localities are indeed widely disjunct. However, the lack of known specimens in intervening areas would be expected given the paucity of suitable surveys. The Mekong is a geographical barrier to some mammals (e.g. squirrels; Timmins and Duckworth 2008), but not others, especially geographically and altitudinally wider ranging taxa in the northern highlands north to the headwater areas of China (e.g. the gibbon <em>Hylobates </em>(<em>Nomascus</em>) <em>leucogenys</em>). Given its altitudinal and geographic range, <em>M. rooseveltorum</em> is likely to belong in the latter category. <br/><br/>These uncertainties mean that <em>M. rooseveltorum</em> can be considered to be currently known only with certainty from the holotype. One further specimen from the Xe Sap National Protected Area of South Laos with skin and skull is very likely to belong to this species (R.J. Timmins pers. comm. 2008 based on material collected by R. Steinmetz and Tanya Chanard). A number of other specimens (poorly documented with respect to morphological features and in the case of Lao specimens also provenance) which have been reported to share the same mitochondrial DNA sequences as the holotype (Amato <em>et al.</em> 1999a; Le <em>et al.</em> 2014 a,b) are also likely to belong to the species, but two closely related species might not be diagnosable with respect to their mtDNA (Ballard and Whitlock 2004), as exemplified by the analogous case of <em>M. gongshanensis</em> and <em>M. crinifrons</em> (see Red List account for <em>M. gongshanensis</em>). Numerous camera-trap photographs from several sites in both Laos and Vietnam show features consistent with the Holotype, yet because of the cautions as laid out above it is best to treat these as only provisional records of the species at present.<br/><br/>Würster-Hill and Seidel (1985) claimed to have analysed the karyotype of <em>M. rooseveltorum</em>, but given the lack of information on the source of their specimen and the means by which it was identified as <em>M. rooseveltorum</em>, and the similarities in karyotype with northern red muntjac <em>M. vaginalis</em>, it has generally been assumed that their tissue originated from a specimen of <em>M. vaginalis</em> (e.g., Groves and Grubb 1990). <br/><br/>Ma <em>et al.</em> (1986) listed <em>M. rooseveltorum</em> for China (seemingly for the first time) with the following statement '<em>M. lachrymans</em> teesdalei described by Lydekker (1915) as having relatively small preorbital pit and premaxillae separated from nasals should be <em>M. rooseveltorum</em>'. Although Lydekker's animal is definitely <em>M. reevesi</em>, Ma <em>et al.</em> (1986) were correct in <em>M. rooseveltorum</em> having the said features. Thus, some records identified as <em>M. reevesi</em> teesdalei in southern China may in fact not be of that taxon and could, given the features of this 1986 description, refer to animals of the <em>M. rooseveltorum </em>complex. Presence of the species-complex in southern China is extremely likely as specimens and photographs of animals in the <em>M. rooseveltorum</em> complex in both Lao PDR and Viet Nam have been obtained close to the Chinese border (R.J. Timmins pers. comm. 2015). Ma <em>et al.</em> (1986) also identified four purchased skins of this species in the Kunming Institute of Zoology as this species, but the identification was revised to <em>M. reevesi </em>by Groves and Grubb (1990) who apparently examined the four skins in the Kunming Institute of Zoology. There is no description of the skins in the above sources, and given the current understanding of muntjac systematics it would likely be hard to diagnose the specific identity of the skins (especially if heads and tails were incomplete or missing) without molecular analysis, their species identity is thus probably best treated as indeterminate at present. <br/><br/>The English name Roosevelt’s Muntjac is often used, but the scientific name is in the genitive plural, and the original account (Osgood 1932) makes clear that both Theodore and Kermit Roosevelt are to be commemorated. Hence, the appropriate English name is Roosevelts’ Muntjac."
13926,Muntiacus gongshanensis,ANIMALIA,CHORDATA,MAMMALIA,CETARTIODACTYLA,CERVIDAE,Muntiacus,gongshanensis,,,,,"Ma in Ma, Wang &amp; Shi, 1990","Existing literature is inconsistent regarding the species of muntjac, additional to Northern Red Muntjac <em>M. vaginalis</em>, in eastern Tibet and Yunnan Province (southwestern China) and northern Myanmar, with reports of <em>M. feae</em> (Zhang <em>et al</em>. 1984, Ma <em>et al</em>. 1986), <em>M. rooseveltorum</em> (Ma <em>et al</em>. 1986) and <em>M. reevesi</em> (Groves and Grubb 1990) made. In all cases identification criteria remain equivocal and are often not stated. Ma (in Ma <em>et al</em>. 1990) described a new species from this region, <em>M. gongshanensis</em>, to which some past claims of the aforementioned other species can probably be attributed. More recently, <em>M. crinifrons</em> has also been said to occur in this area, which lies far from its generally accepted range (in south-east China; e.g. Lu and Sheng 1984), but this stems entirely from a decision, based upon a similarity of analysed portions of mtDNA, to consider <em>M. gongshanensis</em> indistinguishable from, and therefore a junior synonym of, <em>M. crinifrons</em>, rather than any evidence that <em>M. crinifrons</em>, and specifically not <em>M. gongshanensis</em>, is in the region. The first report was from north Myanmar (Rabinowitz <em>et al</em>. 1998; Amato <em>et al</em>. 1999b, 2000), which led to this claim that <em>M. gongshanensis</em> is indistinguishable from <em>M. crinifrons</em>; but to thereby consider the two as synonymous ignores the cautions and dangers of relying solely upon mtDNA to determine species phylogenies and identifications (see Ballard and Whitlock 2004, and references therein). Specifically, no consideration was given to possibilities that non-conspecific populations might possess very similar, perhaps identical, mtDNA, although there are several reasons why they sometimes do so (Ballard and Whitlock 2004). There are subsequent reports of muntjacs under the name '<em>M. crinifrons</em>' from areas of China adjacent to north Myanmar and some way to the west (Schaller and Rabinowitz 2004, Chen <em>et al</em>. 2007). The identification in Chen <em>et al</em>. (2007) was based explicitly solely on mtDNA and <em>M. gongshanensis</em> may not have been considered (the name <em>M. gongshanensis</em> was associated with the name 'Roosevelt’s Muntjak' [sic], for which the code 'Mgon'; was used; yet no result was given anywhere for 'Mgon', nor is either species discussed); Schaller and Rabinowitz (2004) simply took <em>M. gongshanensis</em> as a synonym of <em>M. crinifrons</em>. Therefore, none of these identifications can be taken as indicative of <em>M. crinifrons</em>, if <em>M. gongshanensis</em> is considered a distinct species (as it is here).<br/> <br/>There is no compelling evidence to treat <em>M. gongshanensis</em> and <em>M. crinifrons</em> as conspecific: the two differ substantially in morphological characters (Ma <em>et al</em>. 1990, Groves and Grubb 1990, R.J. Timmins pers. comm. 2008), reportedly also in karyotype (Huang <em>et al</em>. 2006) and even in mtDNA (Lan <em>et al</em>. 1995, Wang Wen and Lan Hong 2000). Nor, because none of the recent records from the region has explicitly identified <em>M. crinifrons</em> as distinct from <em>M. gongshanensis</em> using any of these features, is there even the most slender of reasons to consider that <em>M. crinifrons</em> occurs in the region in addition to <em>M. gongshanensis</em>. All available specimens of this sort of muntjac from Myanmar at the Natural History Museum (London; NHM) and the Field Museum (Chicago, USA; FMNH) and camera-trap photographs (WCS Myanmar Programme unpublished data) with diagnostic characters visible agree with the type material of <em>M. gongshanensis</em> as assessed by R.J. Timmins (pers. comm. 2008), using data on <em>M. gongshanensis</em> types provided by W.G. Robichaud during a visit to the Kunming Institute of Zoology (Yunnan, China) and from images of the holotype shortly after capture supplied by Lan Hong. These Myanmar records are all treated here as being of <em>M. gongshanensis</em>. Over most of the wider area very little camera trapping has been carried out and specimens are not available; so it cannot be excluded that additional muntjac taxa occur, potentially even perhaps <em>M. crinifrons</em> itself.  <br/> <br/>Several authors have listed <em>M. feae</em> for eastern Tibet (Xizang autonomous region) and southwestern China (Yunnan Province) (Zhang <em>et al</em>. 1984, Sokolov 1957, Ma <em>et al</em>. 1986), and Groves and Grubb (1990) grouped various specimens from this area and northern Myanmar (most likely to be <em>M. gongshanensis</em> on current taxonomy) with <em>M. feae</em> pending description of a new taxon, which they were aware was soon to be forthcoming (i.e. <em>M. gongshanensis</em>). The Kunming Institute of Zoology also has several specimens from this area labelled as <em>M. feae</em> (W.G. Robichaud <em>in litt.</em> to R.J. Timmins pers. comm. 2008). Although several of these records refer clearly to <em>M. gongshanensis</em>, some others (e.g. Zhang <em>et al</em>. 1984, Sokolov 1957, Wirth and Groves 1988) are probably still better treated as unidentifiable <em>Muntiacus</em> sp. because diagnostic details, based on the current understanding of muntjac systematics, are not available. <em>M. feae</em> is still, however, routinely included in the mammalian fauna of China, often without mention of <em>M. gongshanensis</em> (e.g. Zhang <em>et al</em>. 1997, Sheng <em>et al</em>. 1999).<br/><br/>Presumed NHM and FMNH specimens of <em>M. gongshanensis </em>from Myanmar were seemingly identified as “Chinese Muntjac” by Dollman (1932). Grubb (2005) considered the skin from Tang Me in Po Me, Tibet, described by Bailey (1914, 1915) as “<em>M. [reevesi] lacrymans</em>” to represent <em>M. gongshanensis</em>, however in view of the potential similarity of the species with other species it would be better to consider this skin of uncertain specific affinity."
13924,Muntiacus crinifrons,ANIMALIA,CHORDATA,MAMMALIA,CETARTIODACTYLA,CERVIDAE,Muntiacus,crinifrons,,,,,"(Sclater, 1885)","Currently, the name <em>Muntiacus crinifrons</em> is only applicable to populations from eastern China (Groves and Grubb 1990). <br/><br/>Recent reports of <em>M. crinifrons </em>in northern Myanmar and adjacent parts of China, which lies far from its generally accepted range (see below), potentially result from confusion with <em>M. gongshanensis </em>Ma <em>et al.</em> 1990, described from the Gaoligongshan. They stem largely from a decision, based upon a similarity of analysed portions of mtDNA, to consider M<em>. gongshanensis </em>to be indistinguishable from, and therefore a junior synonym of, <em>M.</em> <em>crinifrons</em>, rather than any evidence that <em>M</em>. <em>crinifrons</em>, and specifically not M. gongshanensis, is in these areas. The first report was from northern Myanmar (Rabinowitz <em>et al.</em> 1998; Amato <em>et al.</em> 1999, 2000), which led to this claim that <em>M</em>. <em>gongshanensis </em>is indistinguishable from <em>M</em>. <em>crinifrons</em>. But to thereby consider the two as synonymous ignores the cautions and dangers of relying solely upon mtDNA to determine species phylogenies and identifications (Ballard and Whitlock 2004). Specifically, no consideration was given to possibilities that non-conspecific populations might possess very similar, perhaps identical, mtDNA, although there are several reasons why they sometimes do so (Ballard and Whitlock 2004). There are subsequent reports of muntjacs under the name '<em>M</em>. <em>crinifrons</em>' from areas of China adjacent to northern Myanmar and some way to the west (Schaller and Rabinowitz 2004, Chen <em>et al.</em> 2007) and adjacent areas of India (Datta 2003, Johnsingh 2004, Mukherjee 2013, Menon 2014). The identification in Chen <em>et al.</em> (2007) was based explicitly solely on mtDNA and <em>M</em>. <em>gongshanensis </em>may not have been considered (the name <em>M. gongshanensis </em>was associated with the name ‘Roosevelt’s Muntjak’ [sic], for which the code ‘Mgon’ was used; yet no result was given anywhere for ‘Mgon’, nor is either species discussed); Schaller and Rabinowitz (2004) took M<em>.</em> <em>gongshanensis </em>as a synonym of <em>M. crinifrons</em>. Therefore, none of these identifications can be taken as clearly indicative of M. <em>crinifrons</em>, if <em>M</em>. <em>gongshanensis </em>is considered a distinct species (as it is here; see also the <em>M</em>. <em>gongshanensis </em>Red List account). <br/><br/><em>M. gongshanensis</em> and <em>M. crinifrons</em> were maintained as distinct by Grubb (2005): the two differ substantially in morphological characters (Ma <em>et al.</em> 1990, Groves and Grubb 1990, R.J. Timmins pers. comm. 2008), reportedly also in karyotype (Huang <em>et al.</em> 2006) and even in mtDNA (Lan <em>et al.</em> 1995, Wang and Lan 2000)."
42396,Capreolus pygargus,ANIMALIA,CHORDATA,MAMMALIA,CETARTIODACTYLA,CERVIDAE,Capreolus,pygargus,,,,,"Pallas, 1771","This taxon was formerly considered a subspecies-group of the European Roe Deer <em>Capreolus capreolus</em>. However, it is now regarded as a species distinct from <em>C. capreolus</em> (Sokolov <em>et al.</em> 1985, Sokolov and Gromov 1990, Randi <em>et al.</em> 1998, Hewison and Danilkin, 2001, Lorenzini <em>et al.</em> 2014 ). It was reviewed by Danilkin (1995).Three subspecies are typically recognized: <em>C. pygargus pygargus </em>Pallas, 1771 (main part of the distribution area), <em>C. p. tianschanicus</em> Saturnin, 1906 (southern part of the range in China) and <em>C. p. bedfordi </em>Thomas, 1908 (eastern part of the range). However, recent phylogenetic analyses could bring into question the existence of these subspecies, Lorenzini <em>et al.</em> (2014) found no relationship between mitochondrial genetic lineages and geographic distribution, and no particular haplogroups corresponding to the proposed subspecies were detected. Further research incorporating nuclear DNA is required to resolve the taxonomy of this group.<br/><br/>Recent molecular studies have detected mitochondrial DNA haplotypes of Siberian Roe Deer in Poland and Lithuania, 2000 km farther west than the western limit of its modern distribution (Lorenzini <em>et al.</em> 2014, Matosiuk <em>et al.</em> 2014, Olano-Marin <em>et al.</em> 2014).Genetic analyses of European Roe deer in Poland suggest that Siberian haplotypes are of ancient origin (they were not detected within the modern range of Siberian Roe Deer) and that genetic introgression occurred as the range of Siberian Roe Deer expanded as far west as Central Europe, and European Roe Deer spread east from western refugia during the last glacial maximum (Lorenzini <em>et al.</em> 2014, Matosiuk <em>et al.</em> 2014). As well or instead of introgression into western Roe, it is possible that Siberian Roe had a more western distribution during the Late Peistocene and may even have gone undetected until today, coexisting with European Roe Deer, further evidence is needed to determine the taxonomic identity of the roes in these parts of Europe that bear Siberian-type mtDNA."
10329,Hydropotes inermis,ANIMALIA,CHORDATA,MAMMALIA,CETARTIODACTYLA,CERVIDAE,Hydropotes,inermis,,,,,"Swinhoe, 1870","There are two subspecies:  
<br><i>H. i. argyropus</i> Heude, 1884; Korea (formerly also in Jilin and Liaoning provinces of China);
<br><I>H. i. inermis</I> Swinhoe, 1870; China (Zhejiang, Jiangsu, Hubei, Henan, Anhui, Guangdong, Fujian, Jiangxi, Shanghai, Guangxi, but now extinct in the southern and western parts of this range)."
